{
  "styleGuide": {
    "url": "https://www.zus.pl/",
    "extractedAt": "2025-10-04T11:09:23.323Z",
    "colorPalette": {
      "color-1": "rgb(0, 0, 0)",
      "color-2": "rgb(0, 120, 52)",
      "color-3": "rgb(255, 255, 255)",
      "color-4": "rgb(17, 120, 59)",
      "color-5": "rgb(239, 239, 239)"
    },
    "typography": {
      "fontFamilies": [
        "Lato Regular",
        "Lato Bold",
        "Arial"
      ],
      "fontSizes": {
        "body": "14px",
        "h1": "12.25px",
        "h2": "19px",
        "h3": "17.0001px",
        "p": "23px",
        "a": "14px",
        "button": "14px",
        "input": "14px",
        "select": "14px",
        "nav": "14px",
        "header": "14px",
        "section": "14px"
      },
      "fontWeights": {
        "body": "400",
        "h1": "500",
        "h2": "400",
        "h3": "400",
        "p": "400",
        "a": "400",
        "button": "400",
        "input": "400",
        "select": "400",
        "nav": "400",
        "header": "400",
        "section": "400"
      }
    },
    "categories": [
      {
        "name": "buttons",
        "elements": [
          {
            "selector": "button",
            "properties": {
              "color": "rgb(0, 0, 0)",
              "background-color": "rgb(239, 239, 239)",
              "font-family": "\"Lato Regular\", \"Helvetica Neue\", Helvetica, Arial, sans-serif",
              "font-size": "14px",
              "font-weight": "400",
              "line-height": "21px",
              "padding": "1px 6px",
              "margin": "0px",
              "border": "2px outset rgb(0, 0, 0)",
              "border-radius": "0px",
              "box-shadow": "none",
              "text-transform": "none"
            }
          },
          {
            "selector": "[type='button']",
            "properties": {
              "cursor": "pointer",
              "-webkit-appearance": "button"
            }
          },
          {
            "selector": "button::-moz-focus-inner",
            "properties": {
              "border-style": "none"
            }
          },
          {
            "selector": "[type='button']::-moz-focus-inner",
            "properties": {
              "border-style": "none"
            }
          },
          {
            "selector": "[type='number']::-webkit-inner-spin-button",
            "properties": {
              "height": "auto"
            }
          },
          {
            "selector": "[type='number']::-webkit-outer-spin-button",
            "properties": {
              "height": "auto"
            }
          },
          {
            "selector": "::-webkit-file-upload-button",
            "properties": {
              "-webkit-appearance": "button",
              "font": "inherit"
            }
          },
          {
            "selector": "button.collapse-icon",
            "properties": {
              "padding-right": "2.28125rem"
            }
          },
          {
            "selector": "button.collapse-icon .c-inner",
            "properties": {
              "margin-right": "-2.28125rem"
            }
          },
          {
            "selector": ".btn",
            "properties": {
              "background-color": "transparent",
              "border": "1px solid transparent",
              "border-radius": ".25rem",
              "color": "#212529",
              "cursor": "pointer",
              "display": "inline-block",
              "font-size": "1rem",
              "font-weight": "400",
              "line-height": "1.5",
              "padding": ".375rem .75rem",
              "text-align": "center",
              "transition": "color .15s ease-in-out,background-color .15s ease-in-out,border-color .15s ease-in-out,box-shadow .15s ease-in-out",
              "user-select": "none",
              "vertical-align": "middle"
            }
          }
        ]
      },
      {
        "name": "inputs",
        "elements": [
          {
            "selector": "input",
            "properties": {
              "color": "rgb(0, 0, 0)",
              "background-color": "rgb(255, 255, 255)",
              "font-family": "\"Lato Regular\", \"Helvetica Neue\", Helvetica, Arial, sans-serif",
              "font-size": "14px",
              "font-weight": "400",
              "line-height": "normal",
              "padding": "0px",
              "margin": "0px",
              "border": "0px none rgb(0, 0, 0)",
              "border-radius": "0px",
              "box-shadow": "none",
              "text-transform": "none"
            }
          },
          {
            "selector": "select",
            "properties": {
              "color": "rgb(0, 0, 0)",
              "background-color": "rgba(0, 0, 0, 0)",
              "font-family": "Arial",
              "font-size": "14px",
              "font-weight": "400",
              "line-height": "19.6px",
              "padding": "0px",
              "margin": "0px",
              "border": "0px none rgb(0, 0, 0)",
              "border-radius": "3px",
              "box-shadow": "none",
              "text-transform": "none"
            }
          },
          {
            "selector": "input[type='date']",
            "properties": {
              "-webkit-appearance": "listbox"
            }
          },
          {
            "selector": "input[type='time']",
            "properties": {
              "-webkit-appearance": "listbox"
            }
          },
          {
            "selector": "input[type='datetime-local']",
            "properties": {
              "-webkit-appearance": "listbox"
            }
          },
          {
            "selector": "input[type='month']",
            "properties": {
              "-webkit-appearance": "listbox"
            }
          },
          {
            "selector": ".form-horizontal>.form-group",
            "properties": {
              "display": "flex",
              "flex-wrap": "wrap",
              "margin-left": "-15px",
              "margin-right": "-15px"
            }
          },
          {
            "selector": ".form-horizontal.container-no-gutters>.form-group",
            "properties": {
              "margin-left": "0",
              "margin-right": "0"
            }
          },
          {
            "selector": ".form-horizontal.container-no-gutters>.form-group>.col",
            "properties": {
              "padding-right": "0",
              "padding-left": "0"
            }
          },
          {
            "selector": ".form-horizontal.container-no-gutters>.form-group>[class*='col-']",
            "properties": {
              "padding-right": "0",
              "padding-left": "0"
            }
          }
        ]
      },
      {
        "name": "typography",
        "elements": [
          {
            "selector": "h1",
            "properties": {
              "color": "rgb(0, 0, 0)",
              "background-color": "rgba(0, 0, 0, 0)",
              "font-family": "\"Lato Regular\", \"Helvetica Neue\", Helvetica, Arial, sans-serif",
              "font-size": "12.25px",
              "font-weight": "500",
              "line-height": "14.7px",
              "padding": "0px",
              "margin": "-1px",
              "border": "0px none rgb(0, 0, 0)",
              "border-radius": "0px",
              "box-shadow": "none",
              "text-transform": "none"
            }
          },
          {
            "selector": "h2",
            "properties": {
              "color": "rgb(0, 0, 0)",
              "background-color": "rgba(0, 0, 0, 0)",
              "font-family": "\"Lato Bold\", \"Helvetica Neue\", Helvetica, Arial, sans-serif",
              "font-size": "19px",
              "font-weight": "400",
              "line-height": "27.9999px",
              "padding": "19.9999px 0px 14.9999px",
              "margin": "0px",
              "border": "0px none rgb(0, 0, 0)",
              "border-radius": "0px",
              "box-shadow": "none",
              "text-transform": "none"
            }
          },
          {
            "selector": "h3",
            "properties": {
              "color": "rgb(0, 0, 0)",
              "background-color": "rgba(0, 0, 0, 0)",
              "font-family": "\"Lato Bold\", \"Helvetica Neue\", Helvetica, Arial, sans-serif",
              "font-size": "17.0001px",
              "font-weight": "400",
              "line-height": "22.0001px",
              "padding": "0px",
              "margin": "0px",
              "border": "0px none rgb(0, 0, 0)",
              "border-radius": "0px",
              "box-shadow": "none",
              "text-transform": "none"
            }
          },
          {
            "selector": "p",
            "properties": {
              "color": "rgb(255, 255, 255)",
              "background-color": "rgba(0, 0, 0, 0)",
              "font-family": "\"Lato Bold\", \"Helvetica Neue\", Helvetica, Arial, sans-serif",
              "font-size": "23px",
              "font-weight": "400",
              "line-height": "34.5px",
              "padding": "0px",
              "margin": "0px",
              "border": "0px none rgb(255, 255, 255)",
              "border-radius": "0px",
              "box-shadow": "none",
              "text-transform": "none"
            }
          },
          {
            "selector": "a",
            "properties": {
              "color": "rgb(17, 120, 59)",
              "background-color": "rgba(0, 0, 0, 0)",
              "font-family": "\"Lato Regular\", \"Helvetica Neue\", Helvetica, Arial, sans-serif",
              "font-size": "14px",
              "font-weight": "400",
              "line-height": "21px",
              "padding": "0px",
              "margin": "15px 0px 0px",
              "border": "0px none rgb(17, 120, 59)",
              "border-radius": "0px",
              "box-shadow": "none",
              "text-transform": "none"
            }
          },
          {
            "selector": "*::after",
            "properties": {
              "box-sizing": "border-box"
            }
          },
          {
            "selector": "main",
            "properties": {
              "display": "block"
            }
          },
          {
            "selector": "h4",
            "properties": {
              "margin-bottom": ".5rem",
              "margin-top": "0"
            }
          },
          {
            "selector": "h5",
            "properties": {
              "margin-bottom": ".5rem",
              "margin-top": "0"
            }
          },
          {
            "selector": "h6",
            "properties": {
              "margin-bottom": ".5rem",
              "margin-top": "0"
            }
          }
        ]
      },
      {
        "name": "layout",
        "elements": [
          {
            "selector": "header",
            "properties": {
              "color": "rgb(0, 0, 0)",
              "background-color": "rgba(0, 0, 0, 0)",
              "font-family": "\"Lato Regular\", \"Helvetica Neue\", Helvetica, Arial, sans-serif",
              "font-size": "14px",
              "font-weight": "400",
              "line-height": "16.8px",
              "padding": "17.9999px 0px 35px",
              "margin": "0px 20px 20px",
              "border": "",
              "border-radius": "0px",
              "box-shadow": "none",
              "text-transform": "none"
            }
          },
          {
            "selector": "section",
            "properties": {
              "color": "rgb(0, 0, 0)",
              "background-color": "rgba(0, 0, 0, 0)",
              "font-family": "\"Lato Regular\", \"Helvetica Neue\", Helvetica, Arial, sans-serif",
              "font-size": "14px",
              "font-weight": "400",
              "line-height": "16.8px",
              "padding": "0px",
              "margin": "0px",
              "border": "0px none rgb(0, 0, 0)",
              "border-radius": "0px",
              "box-shadow": "none",
              "text-transform": "none"
            }
          },
          {
            "selector": ".zus .b-row .b-section",
            "properties": {
              "margin-bottom": "40px"
            }
          }
        ]
      },
      {
        "name": "navigation",
        "elements": [
          {
            "selector": "nav",
            "properties": {
              "color": "rgb(0, 0, 0)",
              "background-color": "rgba(0, 0, 0, 0)",
              "font-family": "\"Lato Regular\", \"Helvetica Neue\", Helvetica, Arial, sans-serif",
              "font-size": "14px",
              "font-weight": "400",
              "line-height": "16.8px",
              "padding": "0px",
              "margin": "0px",
              "border": "0px none rgb(0, 0, 0)",
              "border-radius": "0px",
              "box-shadow": "none",
              "text-transform": "none"
            }
          },
          {
            "selector": ".menu",
            "properties": {
              "position": "absolute",
              "width": "auto"
            }
          },
          {
            "selector": ".menu-content",
            "properties": {
              "background": "#fff",
              "list-style": "none",
              "min-width": "150px"
            }
          },
          {
            "selector": ".menu-content li",
            "properties": {
              "margin": "0",
              "padding": "0"
            }
          },
          {
            "selector": ".menu-content li.first",
            "properties": {
              "border-top-width": "0"
            }
          },
          {
            "selector": "body>.lfr-menu-list ul",
            "properties": {
              "border-radius": "4px"
            }
          },
          {
            "selector": ".ui-selectmenu-menu",
            "properties": {
              "padding": "0",
              "margin": "-4px 0 0",
              "position": "absolute",
              "top": "0",
              "left": "0",
              "display": "none"
            }
          },
          {
            "selector": ".ui-selectmenu-menu .ui-menu",
            "properties": {
              "overflow": "auto",
              "max-height": "308px",
              "list-style": "none",
              "padding": "0",
              "overflow-x": "hidden",
              "margin": "0"
            }
          },
          {
            "selector": ".ie8 .ui-selectmenu-menu",
            "properties": {
              "border": "1px solid #d0d0d0"
            }
          },
          {
            "selector": ".ie7 .ui-selectmenu-menu",
            "properties": {
              "border": "1px solid #d0d0d0"
            }
          }
        ]
      }
    ]
  },
  "summary": "\n# Style Guide for https://www.zus.pl/\nExtracted at: 2025-10-04T11:09:23.323Z\n\n## Color Palette\n- color-1: rgb(0, 0, 0)\n- color-2: rgb(0, 120, 52)\n- color-3: rgb(255, 255, 255)\n- color-4: rgb(17, 120, 59)\n- color-5: rgb(239, 239, 239)\n\n## Typography\n### Font Families\n- Lato Regular\n- Lato Bold\n- Arial\n\n### Font Sizes\n- body: 14px\n- h1: 12.25px\n- h2: 19px\n- h3: 17.0001px\n- p: 23px\n- a: 14px\n- button: 14px\n- input: 14px\n- select: 14px\n- nav: 14px\n- header: 14px\n- section: 14px\n\n### Font Weights\n- body: 400\n- h1: 500\n- h2: 400\n- h3: 400\n- p: 400\n- a: 400\n- button: 400\n- input: 400\n- select: 400\n- nav: 400\n- header: 400\n- section: 400\n\n## Component Styles\n\n### Buttons\n\n#### button\n```css\ncolor: rgb(0, 0, 0);\nbackground-color: rgb(239, 239, 239);\nfont-family: \"Lato Regular\", \"Helvetica Neue\", Helvetica, Arial, sans-serif;\nfont-size: 14px;\nfont-weight: 400;\nline-height: 21px;\npadding: 1px 6px;\nmargin: 0px;\nborder: 2px outset rgb(0, 0, 0);\nborder-radius: 0px;\nbox-shadow: none;\ntext-transform: none;\n```\n\n#### [type='button']\n```css\ncursor: pointer;\n-webkit-appearance: button;\n```\n\n#### button::-moz-focus-inner\n```css\nborder-style: none;\n```\n\n#### [type='button']::-moz-focus-inner\n```css\nborder-style: none;\n```\n\n#### [type='number']::-webkit-inner-spin-button\n```css\nheight: auto;\n```\n\n#### [type='number']::-webkit-outer-spin-button\n```css\nheight: auto;\n```\n\n#### ::-webkit-file-upload-button\n```css\n-webkit-appearance: button;\nfont: inherit;\n```\n\n#### button.collapse-icon\n```css\npadding-right: 2.28125rem;\n```\n\n#### button.collapse-icon .c-inner\n```css\nmargin-right: -2.28125rem;\n```\n\n#### .btn\n```css\nbackground-color: transparent;\nborder: 1px solid transparent;\nborder-radius: .25rem;\ncolor: #212529;\ncursor: pointer;\ndisplay: inline-block;\nfont-size: 1rem;\nfont-weight: 400;\nline-height: 1.5;\npadding: .375rem .75rem;\ntext-align: center;\ntransition: color .15s ease-in-out,background-color .15s ease-in-out,border-color .15s ease-in-out,box-shadow .15s ease-in-out;\nuser-select: none;\nvertical-align: middle;\n```\n\n\n### Inputs\n\n#### input\n```css\ncolor: rgb(0, 0, 0);\nbackground-color: rgb(255, 255, 255);\nfont-family: \"Lato Regular\", \"Helvetica Neue\", Helvetica, Arial, sans-serif;\nfont-size: 14px;\nfont-weight: 400;\nline-height: normal;\npadding: 0px;\nmargin: 0px;\nborder: 0px none rgb(0, 0, 0);\nborder-radius: 0px;\nbox-shadow: none;\ntext-transform: none;\n```\n\n#### select\n```css\ncolor: rgb(0, 0, 0);\nbackground-color: rgba(0, 0, 0, 0);\nfont-family: Arial;\nfont-size: 14px;\nfont-weight: 400;\nline-height: 19.6px;\npadding: 0px;\nmargin: 0px;\nborder: 0px none rgb(0, 0, 0);\nborder-radius: 3px;\nbox-shadow: none;\ntext-transform: none;\n```\n\n#### input[type='date']\n```css\n-webkit-appearance: listbox;\n```\n\n#### input[type='time']\n```css\n-webkit-appearance: listbox;\n```\n\n#### input[type='datetime-local']\n```css\n-webkit-appearance: listbox;\n```\n\n#### input[type='month']\n```css\n-webkit-appearance: listbox;\n```\n\n#### .form-horizontal>.form-group\n```css\ndisplay: flex;\nflex-wrap: wrap;\nmargin-left: -15px;\nmargin-right: -15px;\n```\n\n#### .form-horizontal.container-no-gutters>.form-group\n```css\nmargin-left: 0;\nmargin-right: 0;\n```\n\n#### .form-horizontal.container-no-gutters>.form-group>.col\n```css\npadding-right: 0;\npadding-left: 0;\n```\n\n#### .form-horizontal.container-no-gutters>.form-group>[class*='col-']\n```css\npadding-right: 0;\npadding-left: 0;\n```\n\n\n### Typography\n\n#### h1\n```css\ncolor: rgb(0, 0, 0);\nbackground-color: rgba(0, 0, 0, 0);\nfont-family: \"Lato Regular\", \"Helvetica Neue\", Helvetica, Arial, sans-serif;\nfont-size: 12.25px;\nfont-weight: 500;\nline-height: 14.7px;\npadding: 0px;\nmargin: -1px;\nborder: 0px none rgb(0, 0, 0);\nborder-radius: 0px;\nbox-shadow: none;\ntext-transform: none;\n```\n\n#### h2\n```css\ncolor: rgb(0, 0, 0);\nbackground-color: rgba(0, 0, 0, 0);\nfont-family: \"Lato Bold\", \"Helvetica Neue\", Helvetica, Arial, sans-serif;\nfont-size: 19px;\nfont-weight: 400;\nline-height: 27.9999px;\npadding: 19.9999px 0px 14.9999px;\nmargin: 0px;\nborder: 0px none rgb(0, 0, 0);\nborder-radius: 0px;\nbox-shadow: none;\ntext-transform: none;\n```\n\n#### h3\n```css\ncolor: rgb(0, 0, 0);\nbackground-color: rgba(0, 0, 0, 0);\nfont-family: \"Lato Bold\", \"Helvetica Neue\", Helvetica, Arial, sans-serif;\nfont-size: 17.0001px;\nfont-weight: 400;\nline-height: 22.0001px;\npadding: 0px;\nmargin: 0px;\nborder: 0px none rgb(0, 0, 0);\nborder-radius: 0px;\nbox-shadow: none;\ntext-transform: none;\n```\n\n#### p\n```css\ncolor: rgb(255, 255, 255);\nbackground-color: rgba(0, 0, 0, 0);\nfont-family: \"Lato Bold\", \"Helvetica Neue\", Helvetica, Arial, sans-serif;\nfont-size: 23px;\nfont-weight: 400;\nline-height: 34.5px;\npadding: 0px;\nmargin: 0px;\nborder: 0px none rgb(255, 255, 255);\nborder-radius: 0px;\nbox-shadow: none;\ntext-transform: none;\n```\n\n#### a\n```css\ncolor: rgb(17, 120, 59);\nbackground-color: rgba(0, 0, 0, 0);\nfont-family: \"Lato Regular\", \"Helvetica Neue\", Helvetica, Arial, sans-serif;\nfont-size: 14px;\nfont-weight: 400;\nline-height: 21px;\npadding: 0px;\nmargin: 15px 0px 0px;\nborder: 0px none rgb(17, 120, 59);\nborder-radius: 0px;\nbox-shadow: none;\ntext-transform: none;\n```\n\n#### *::after\n```css\nbox-sizing: border-box;\n```\n\n#### main\n```css\ndisplay: block;\n```\n\n#### h4\n```css\nmargin-bottom: .5rem;\nmargin-top: 0;\n```\n\n#### h5\n```css\nmargin-bottom: .5rem;\nmargin-top: 0;\n```\n\n#### h6\n```css\nmargin-bottom: .5rem;\nmargin-top: 0;\n```\n\n\n### Layout\n\n#### header\n```css\ncolor: rgb(0, 0, 0);\nbackground-color: rgba(0, 0, 0, 0);\nfont-family: \"Lato Regular\", \"Helvetica Neue\", Helvetica, Arial, sans-serif;\nfont-size: 14px;\nfont-weight: 400;\nline-height: 16.8px;\npadding: 17.9999px 0px 35px;\nmargin: 0px 20px 20px;\nborder: ;\nborder-radius: 0px;\nbox-shadow: none;\ntext-transform: none;\n```\n\n#### section\n```css\ncolor: rgb(0, 0, 0);\nbackground-color: rgba(0, 0, 0, 0);\nfont-family: \"Lato Regular\", \"Helvetica Neue\", Helvetica, Arial, sans-serif;\nfont-size: 14px;\nfont-weight: 400;\nline-height: 16.8px;\npadding: 0px;\nmargin: 0px;\nborder: 0px none rgb(0, 0, 0);\nborder-radius: 0px;\nbox-shadow: none;\ntext-transform: none;\n```\n\n#### .zus .b-row .b-section\n```css\nmargin-bottom: 40px;\n```\n\n\n### Navigation\n\n#### nav\n```css\ncolor: rgb(0, 0, 0);\nbackground-color: rgba(0, 0, 0, 0);\nfont-family: \"Lato Regular\", \"Helvetica Neue\", Helvetica, Arial, sans-serif;\nfont-size: 14px;\nfont-weight: 400;\nline-height: 16.8px;\npadding: 0px;\nmargin: 0px;\nborder: 0px none rgb(0, 0, 0);\nborder-radius: 0px;\nbox-shadow: none;\ntext-transform: none;\n```\n\n#### .menu\n```css\nposition: absolute;\nwidth: auto;\n```\n\n#### .menu-content\n```css\nbackground: #fff;\nlist-style: none;\nmin-width: 150px;\n```\n\n#### .menu-content li\n```css\nmargin: 0;\npadding: 0;\n```\n\n#### .menu-content li.first\n```css\nborder-top-width: 0;\n```\n\n#### body>.lfr-menu-list ul\n```css\nborder-radius: 4px;\n```\n\n#### .ui-selectmenu-menu\n```css\npadding: 0;\nmargin: -4px 0 0;\nposition: absolute;\ntop: 0;\nleft: 0;\ndisplay: none;\n```\n\n#### .ui-selectmenu-menu .ui-menu\n```css\noverflow: auto;\nmax-height: 308px;\nlist-style: none;\npadding: 0;\noverflow-x: hidden;\nmargin: 0;\n```\n\n#### .ie8 .ui-selectmenu-menu\n```css\nborder: 1px solid #d0d0d0;\n```\n\n#### .ie7 .ui-selectmenu-menu\n```css\nborder: 1px solid #d0d0d0;\n```\n\n\n"
}